{"artifact_hash_contract":"SHA256_EXACT_BUNDLE_MANIFEST_BYTES","artifact_id":"A1-SUPPLEMENT-QC-PROVENANCE-01","artifact_revision":1,"canonical_json":"UTF-8_NO_BOM_LF_SORTED_KEYS_COMPACT","data_classification":"PUBLIC_SYNTHETIC","exact_member_names":["bundle_manifest.json","decision_evidence.json","modeled_cohort_synthetic_receipt.json","payload_manifest.json","qc_table.csv","runtime_metadata.json","synthetic_input_receipt.json","validation_receipt.json"],"members":[{"path":"decision_evidence.json","role":"decision_evidence","sha256":"da40b8faa668ada0c3ef80312acd947af85c0b56a6ac208e54b01383f0279ef0"},{"path":"modeled_cohort_synthetic_receipt.json","role":"modeled_cohort_synthetic_receipt","sha256":"b534246d3049052d5117410c2e06e4524b7b057115e9c6fa13d47789a45cd69e"},{"path":"payload_manifest.json","role":"payload_manifest","sha256":"ece7adcdd6ca4b4188b5e4454e7acb4762beef822c9411f3013888b663599051"},{"path":"qc_table.csv","role":"qc_table","sha256":"fda66fc299a212ec249d8534357e67603f2156b0e85dd6d632f6f348102347d6"},{"path":"runtime_metadata.json","role":"runtime_metadata","sha256":"45f64c3cdaf47439c6f52247f43668977f4b089d7366a90c7c73740f4a099c81"},{"path":"synthetic_input_receipt.json","role":"synthetic_input_receipt","sha256":"e15ea601a632cd785af71ce09d229dd0cf511e2358ba0d252ec67d51fa2afac5"},{"path":"validation_receipt.json","role":"validation_receipt","sha256":"2baf6a8fb6ad0e86a01741017a7cbe46454533f3ab4306b391d8ac205d5d470c"}],"payload_manifest_sha256":"ece7adcdd6ca4b4188b5e4454e7acb4762beef822c9411f3013888b663599051","schema_version":"1.0.0","synthetic_disclaimer":"Synthetic structural-validation evidence only; not study findings.","timestamp_policy":"OMITTED_FROM_CANONICAL_IDENTITY","validation_receipt_sha256":"2baf6a8fb6ad0e86a01741017a7cbe46454533f3ab4306b391d8ac205d5d470c"}
